{
  "$schema": "https://json-schema.org/draft/2020-12/schema",
  "$id": "https://contracts.cybrik.example/json-schema/cybrik.claim.v1.schema.json",
  "title": "CYBRIK investigation claim v1",
  "description": "A single claim asserted (or abstained) within an investigation. The claim's `statement`/`confidence` are UNTRUSTED, advisory analyst-support content — never an authorization or action trigger (same TR-6 stance as the accepted W2-D inference packet's summary_text). An 'asserted' claim MUST cite at least one grounding evidence_refs entry (roadmap Week 2: 'Claim/evidence validator, citation dereference và digest'); an 'abstained' claim MUST instead record why (roadmap Week 2: 'Abstention/missing-evidence output') and MUST NOT carry a confidence level. Claims carry NO tool/capability/delegation/approval/action field — asserting or abstaining is descriptive output, never itself an execution-authority grant (disjoint from ADR-0004). Status: ACCEPTED FOR IMPLEMENTATION (v0.1.0; not stable v1/GA) by explicit Founder Option A and G-W0I01-1..5=yes on 2026-07-26.",
  "x-cybrik-status": "ACCEPTED FOR IMPLEMENTATION",
  "x-cybrik-not-accepted": false,
  "x-cybrik-contract-version": "0.1.0",
  "type": "object",
  "additionalProperties": false,
  "required": ["claim_id", "claim_digest", "investigation_id", "tenant_id", "status", "statement", "produced_by", "data_marking", "created_at"],
  "properties": {
    "claim_id": { "$ref": "cybrik.common-defs.v1.schema.json#/$defs/uuid" },
    "claim_digest": {
      "$ref": "cybrik.common-defs.v1.schema.json#/$defs/sha256Digest",
      "description": "Content digest of this claim record itself. This is the digest a bundle's claims[] cites (structural replay anchor)."
    },
    "investigation_id": {
      "$ref": "cybrik.common-defs.v1.schema.json#/$defs/uuid",
      "description": "Parent cybrik.investigation.v1.investigation_id. Required — a claim is always investigation-scoped (ADR-0006 E6)."
    },
    "tenant_id": { "$ref": "cybrik.common-defs.v1.schema.json#/$defs/tenantId" },
    "status": { "$ref": "cybrik.investigation-common-defs.v1.schema.json#/$defs/claimStatus" },
    "statement": {
      "type": "string",
      "description": "What is being claimed, or — when status='abstained' — what could not be determined and why it matters. Untrusted advisory text.",
      "minLength": 1,
      "maxLength": 2000
    },
    "confidence": {
      "$ref": "cybrik.investigation-common-defs.v1.schema.json#/$defs/confidenceLevel",
      "description": "Required when status='asserted'; MUST be absent when status='abstained' (see allOf)."
    },
    "evidence_refs": {
      "type": "array",
      "description": "Digest-bound references to cybrik.evidence.v1 entries grounding this claim (digest here == that evidence's evidence_digest, not its source_ref.digest). Referenced, not inlined — the platform dereferences through the owner's authorized evidence store. Required to be non-empty when status='asserted' (see allOf); a runtime invariant (schema cannot express it) additionally requires every digest here to match a real evidence_digest at the same investigation_id (citation dereference — roadmap Week 2).",
      "items": { "$ref": "cybrik.common-defs.v1.schema.json#/$defs/objectRef" },
      "maxItems": 200,
      "default": []
    },
    "abstention_reason": {
      "$ref": "cybrik.investigation-common-defs.v1.schema.json#/$defs/abstentionReason",
      "description": "Required when status='abstained' (see allOf)."
    },
    "produced_by": {
      "allOf": [
        { "$ref": "cybrik.common-defs.v1.schema.json#/$defs/actor" },
        { "required": ["tenant_id"] }
      ],
      "description": "Authenticated actor (typically an agent) that produced the claim. Written only by authenticated service code; a model can never self-assert this identity."
    },
    "data_marking": { "$ref": "cybrik.data-marking.v1.schema.json" },
    "created_at": { "$ref": "cybrik.common-defs.v1.schema.json#/$defs/timestampUtc" }
  },
  "allOf": [
    {
      "if": { "properties": { "status": { "const": "asserted" } }, "required": ["status"] },
      "then": {
        "required": ["confidence", "evidence_refs"],
        "properties": { "evidence_refs": { "minItems": 1 } }
      }
    },
    {
      "if": { "properties": { "status": { "const": "abstained" } }, "required": ["status"] },
      "then": {
        "required": ["abstention_reason"],
        "not": { "required": ["confidence"] }
      }
    }
  ]
}
