{
  "claim_id": "ee9671a0-0bac-4f17-893b-7513b6550bec",
  "claim_digest": "sha256:01aa8fdd72d5637786b31cb04be569615672f938ce616fd0b237e7e05a71037e",
  "investigation_id": "06ef7978-e1b2-45bf-8511-a73fa68a6932",
  "tenant_id": "tenant-acme",
  "status": "asserted",
  "statement": "WKS-0042 executed psexec.exe as SYSTEM against SRV-DC01\\ADMIN$; the host was subsequently isolated pending review — consistent with attempted lateral movement.",
  "confidence": "medium",
  "evidence_refs": [
    {
      "type": "cybrik.evidence",
      "id": "3c859ff3-8942-444b-b9d8-8b9819284ba3",
      "digest": "sha256:947d8135a30447350e3211c52182862c7c53bc2ba9b58151b48672fcf8bc10f3"
    },
    {
      "type": "cybrik.evidence",
      "id": "24365f31-e256-42d5-93e1-4d94fc9f5aa2",
      "digest": "sha256:6541fb80d276bc28a023e778975dfe86f81b7e1766eb17aea21506cd21df6f3d"
    }
  ],
  "produced_by": {
    "type": "agent",
    "id": "spiffe://cybrik/tenant-acme/ai/agent/investigator-07",
    "tenant_id": "tenant-acme"
  },
  "data_marking": {
    "classification": "confidential",
    "tlp": "TLP:AMBER"
  },
  "created_at": "2026-07-25T09:25:00Z"
}
